{"$id":"session","$schema":"https://json-schema.org/draft/2020-12/schema","description":"Diagnostic session header; all state changes live in the event log.","properties":{"created_ts":{"format":"date-time","type":"string"},"engine_version":{"type":"string"},"kp_version":{"description":"Knowledge-pack version, e.g. 'ford-gen-v1'.","type":"string"},"mode":{"description":"live, sim or replay.","enum":["live","replay","sim"]},"model_pins":{"description":"Pinned Meta model ids used by this session.","type":"object"},"session_id":{"type":"string"},"tools":{"description":"Tools the user has (planner filters on this).","items":{"type":"string"},"type":"array"},"user_level":{"enum":["L1","L2","L3"]},"vehicle":{"$ref":"vehicle.json"}},"required":["engine_version","kp_version","mode","model_pins","session_id","tools","user_level"],"type":"object"}
